{
  "parameter_id": 1,
  "parameter_code": "PZ-001",
  "pd_section": "Раздел 1. ПЗ",
  "parameter_name": "Площадь застройки",
  "unit": "м²",
  "source_pd": "Раздел ПЗУ: Таблица ТЭП",
  "source_rd": "Раздел ПП (ГП): Лист \"Общие данные\", Таблица ТЭП",
  "source_id": "Технический план БТИ; Акт выноса осей",
  "trigger": "Расхождение контуров здания на генплане с данными БТИ или РД > 0.",
  "criticality": "Критическое (приостановка работ)",
  "matrix_row": 2,
  "mapping_status": "SOURCE_MATRIX"
}
